{
  "story_key": "hormuz_iran",
  "story_title": "Strait of Hormuz / US-Iran deal",
  "window_start": "2026-05-08",
  "window_end": "2026-05-08",
  "n_days_with_analysis": 1,
  "meta_version_segments": [
    {
      "meta_version": "1.4.1",
      "from_date": "2026-05-08",
      "to_date": "2026-05-08",
      "n_days": 1
    }
  ],
  "bucket_set_signatures": [
    {
      "signature": "3c20fb4dea098a94",
      "from_date": "2026-05-08",
      "to_date": "2026-05-08",
      "n_buckets": 3,
      "buckets": [
        "canada",
        "asia_pacific_regional",
        "brazil"
      ]
    }
  ],
  "daily_summaries": [
    {
      "date": "2026-05-08",
      "meta_version": "1.4.1",
      "n_buckets": 3,
      "n_articles": 59,
      "n_frames": 5,
      "bucket_set_signature": "3c20fb4dea098a94"
    }
  ],
  "frame_trajectories": {
    "ECONOMIC_BLOCKADE_EFFICACY": [
      {
        "date": "2026-05-08",
        "n_buckets_carrying": 1,
        "n_buckets_total": 3,
        "share": 0.333,
        "meta_version": "1.4.1"
      }
    ],
    "CEASEFIRE_FRAGILITY": [
      {
        "date": "2026-05-08",
        "n_buckets_carrying": 1,
        "n_buckets_total": 3,
        "share": 0.333,
        "meta_version": "1.4.1"
      }
    ],
    "REGIONAL_ECONOMIC_CRISIS": [
      {
        "date": "2026-05-08",
        "n_buckets_carrying": 1,
        "n_buckets_total": 3,
        "share": 0.333,
        "meta_version": "1.4.1"
      }
    ],
    "DEAL_NEGOTIATION_WINDOW": [
      {
        "date": "2026-05-08",
        "n_buckets_carrying": 1,
        "n_buckets_total": 3,
        "share": 0.333,
        "meta_version": "1.4.1"
      }
    ],
    "MARITIME_CONTROL_FORMALIZATION": [
      {
        "date": "2026-05-08",
        "n_buckets_carrying": 1,
        "n_buckets_total": 3,
        "share": 0.333,
        "meta_version": "1.4.1"
      }
    ]
  },
  "meta_version": "7.0.1"
}
